source,publisher,title,summary,url,published_dt,date,raw_text,relevance_score
dawn_business,dawn,Crude oil theft network busted in Tando Allahyar,"ISLAMABAD: The Oil and Gas Development Company Limited (OGDCL) on Wednesday said it had uncovered a major crude oil theft operation and an illegal refinery in Sindh’s Tando Allahyar district and sought strict legal action against those involved. “The theft involved illegal tapping of the Kunnar Pasakhi Deep (KPD)-TAY oil field pipeline near Tando Jam, close to the Machhi Hotel police check post. The stolen crude oil was being transported and processed at an illegal refinery before being sold in the local market,” the state-run oil and gas producer said. The company said it had initiated a coordinated investigation in January 2026, working closely with intelligence and law enforcement agencies to trace the network. After weeks of surveillance and technical tracking, it identified multiple tapping points along the pipeline as well as the location of the illegal refining facility. A raid was carried out in the Siri area of New Hyderabad City with the participation of eight police vehicles, five OGDCL vehicles and support from an intelligence agency. During the operation, authorities recovered refining equipment and a large quantity of stolen crude oil. The suspects fled the scene, leaving behind five motorcycles. The Tando Jam police registered a case against the alleged gang leader, Wazir Daudani, along with his associates Ghani Daudani, Badshah Nizamani, Mabaan Nizamani and six others. Police also seized three Suzuki vehicles and a Mazda truck carrying stolen crude oil, the company said. The company did not specify how long the illegal operation had been underway or the extent of losses incurred. Published in Dawn, March 26th, 2026",https://www.dawn.com/news/1985329/crude-oil-theft-network-busted-in-tando-allahyar,2026-03-26T07:14:40+05:00,2026-03-26,"Crude oil theft network busted in Tando Allahyar ISLAMABAD: The Oil and Gas Development Company Limited (OGDCL) on Wednesday said it had uncovered a major crude oil theft operation and an illegal refinery in Sindh’s Tando Allahyar district and sought strict legal action against those involved. “The theft involved illegal tapping of the Kunnar Pasakhi Deep (KPD)-TAY oil field pipeline near Tando Jam, close to the Machhi Hotel police check post. The stolen crude oil was being transported and processed at an illegal refinery before being sold in the local market,” the state-run oil and gas producer said. The company said it had initiated a coordinated investigation in January 2026, working closely with intelligence and law enforcement agencies to trace the network. After weeks of surveillance and technical tracking, it identified multiple tapping points along the pipeline as well as the location of the illegal refining facility. A raid was carried out in the Siri area of New Hyderabad City with the participation of eight police vehicles, five OGDCL vehicles and support from an intelligence agency. During the operation, authorities recovered refining equipment and a large quantity of stolen crude oil. The suspects fled the scene, leaving behind five motorcycles. The Tando Jam police registered a case against the alleged gang leader, Wazir Daudani, along with his associates Ghani Daudani, Badshah Nizamani, Mabaan Nizamani and six others. Police also seized three Suzuki vehicles and a Mazda truck carrying stolen crude oil, the company said. The company did not specify how long the illegal operation had been underway or the extent of losses incurred. Published in Dawn, March 26th, 2026",2
dawn_business,dawn,"Request for preferential energy cargoes will be ‘considered favourably’, Oman envoy assures petroleum minister","Oman’s envoy to Pakistan, Fahad Bin Sulaiman Bin Khalaf Alkharusi, assured Petroleum Minister Ali Pervaiz Malik on Thursday that Islamabad’s request for preferential energy cargoes would be “considered favourably”, a statement issued by the Petroleum Division said. The statement detailed the meeting between the two dignitaries in Islamabad, stating that Ambassador Alkharusi “welcomed Pakistan’s push towards diversification and conveyed that Oman stands ready to support Pakistan in enhancing its energy security”. “In this regard, the federal minister expressed optimism that Oman would consider Pakistan’s request for preferential energy cargoes to meet its growing requirements. The ambassador responded positively and assured that the request would be considered favourably,” it added. The statement said that the two discussed the evolving energy situation in the region and avenues for strengthening bilateral cooperation in the energy sector. “The federal minister highlighted that Pakistan and Oman enjoy long-standing, cordial and brotherly relations, rooted in shared history, mutual respect and strong people-to-people ties. He reaffirmed Pakistan’s commitment to further expand the bilateral energy partnership and explore new areas of collaboration,” it said. Moreover, the minister apprised the ambassador of Pakistan’s ongoing efforts to diversify its energy imports and ensure supply resilience, particularly by exploring alternative routes and sources outside the Strait of Hormuz in light of the changing regional dynamics, the statement said. According to the statement, three cargoes of petrol and one cargo of diesel were imported from the ports of Oman during March, and two more cargoes of petrol will be imported from Oman ports in the same month. The world has been facing a global fuel crunch in the aftermath of a US-Israeli war on Iran, which has been going on for nearly a month. The fuel crisis has resulted from the disruption of traffic in the Strait of Hormuz — a corridor that carries 20 per cent of global liquified natural gas and a quarter of seaborne oil. But last week, Malik said that despite the closure of the Strait, Saudi Arabia was “providing an uninterrupted supply of crude oil to Pakistan through the Red Sea, while the United Arab Emirates is also providing oil to us through Fujairah out of the Strait waterways”. Earlier this week, members of the committee formed to monitor petrol prices were told that cargo inflows were continuing as scheduled and petrol cargoes for the current month and for April had “largely been secured”, with additional shipments planned to further strengthen supply buffers. However, the government has warned that the situation could worsen if the conflict continues and has taken multiple steps in light of the situation, including a Rs55 per litre hike in the prices of petrol and high-speed diesel in early March and the adoption of austerity and fuel-conservation measures . During the meeting between Malik and Alkharusi, “it was noted that Pakistan State Oil and Oman Trading International are also engaged in constructive discussions to explore the possibility of additional oil cargoes to help meet Pakistan’s energy demand,” the Petroleum Division statement said. It added that opportunities for enhanced cooperation in the upstream sector, including exploration and production, were also discussed during the meeting while the importance of expanding collaboration in oil and gas development projects was also emphasised. “Both sides reaffirmed their shared commitment to further deepen Pakistan-Oman cooperation in the energy sector and strengthen strategic ties for mutual benefit,” the statement said.",https://www.dawn.com/news/1985601/request-for-preferential-energy-cargoes-will-be-considered-favourably-oman-envoy-assures-petroleum-minister,2026-03-26T21:11:37+05:00,2026-03-26,"Request for preferential energy cargoes will be ‘considered favourably’, Oman envoy assures petroleum minister Oman’s envoy to Pakistan, Fahad Bin Sulaiman Bin Khalaf Alkharusi, assured Petroleum Minister Ali Pervaiz Malik on Thursday that Islamabad’s request for preferential energy cargoes would be “considered favourably”, a statement issued by the Petroleum Division said. The statement detailed the meeting between the two dignitaries in Islamabad, stating that Ambassador Alkharusi “welcomed Pakistan’s push towards diversification and conveyed that Oman stands ready to support Pakistan in enhancing its energy security”. “In this regard, the federal minister expressed optimism that Oman would consider Pakistan’s request for preferential energy cargoes to meet its growing requirements. The ambassador responded positively and assured that the request would be considered favourably,” it added. The statement said that the two discussed the evolving energy situation in the region and avenues for strengthening bilateral cooperation in the energy sector. “The federal minister highlighted that Pakistan and Oman enjoy long-standing, cordial and brotherly relations, rooted in shared history, mutual respect and strong people-to-people ties. He reaffirmed Pakistan’s commitment to further expand the bilateral energy partnership and explore new areas of collaboration,” it said. Moreover, the minister apprised the ambassador of Pakistan’s ongoing efforts to diversify its energy imports and ensure supply resilience, particularly by exploring alternative routes and sources outside the Strait of Hormuz in light of the changing regional dynamics, the statement said. According to the statement, three cargoes of petrol and one cargo of diesel were imported from the ports of Oman during March, and two more cargoes of petrol will be imported from Oman ports in the same month. The world has been facing a global fuel crunch in the aftermath of a US-Israeli war on Iran, which has been going on for nearly a month. The fuel crisis has resulted from the disruption of traffic in the Strait of Hormuz — a corridor that carries 20 per cent of global liquified natural gas and a quarter of seaborne oil. But last week, Malik said that despite the closure of the Strait, Saudi Arabia was “providing an uninterrupted supply of crude oil to Pakistan through the Red Sea, while the United Arab Emirates is also providing oil to us through Fujairah out of the Strait waterways”. Earlier this week, members of the committee formed to monitor petrol prices were told that cargo inflows were continuing as scheduled and petrol cargoes for the current month and for April had “largely been secured”, with additional shipments planned to further strengthen supply buffers. However, the government has warned that the situation could worsen if the conflict continues and has taken multiple steps in light of the situation, including a Rs55 per litre hike in the prices of petrol and high-speed diesel in early March and the adoption of austerity and fuel-conservation measures . During the meeting between Malik and Alkharusi, “it was noted that Pakistan State Oil and Oman Trading International are also engaged in constructive discussions to explore the possibility of additional oil cargoes to help meet Pakistan’s energy demand,” the Petroleum Division statement said. It added that opportunities for enhanced cooperation in the upstream sector, including exploration and production, were also discussed during the meeting while the importance of expanding collaboration in oil and gas development projects was also emphasised. “Both sides reaffirmed their shared commitment to further deepen Pakistan-Oman cooperation in the energy sector and strengthen strategic ties for mutual benefit,” the statement said.",1
dawn_business,dawn,"Bears take control as PSX plunges over 5,000 points","The Pakistan Stock Exchange’s (PSX) benchmark index KSE-100 plunged over 5,000 points on Thursday. The KSE-100 declined by 5,405.48 points or 3.41 per cent to close at 152,907.96 from the previous close of 158,313.44. The index rose to an intraday high of 157,591.23 points at around 10:05am, and then declined to an intraday low of 152,668.07 points at around 3:15pm, before settling at 152,907.96. According to Topline Securities, “the market experienced sustained selling pressure throughout the day”. It added that the index “predominantly” traded in “negative territory as investors remained cautious amid persistent volatility in international oil prices and ongoing global uncertainty”. Topline Securities noted that “key index-heavy stocks, including United Bank Limited, Fauji Fertiliser Company, Engro Holdings Limited, Lucky Cement Limited, and the Hub Power Company Limited, acted as major drags on the market”. It said that the companies “collectively” pulled the index down “by approximately 2,138 points during the session”. It added that in terms of volume, K-Electric Limited “led the activity chart, with over 96 million shares traded during the day”. “The total traded volume for the session stood at 521m shares, while the overall traded value was recorded at Rs27 billion,” it added. On Wednesday, value-hunting had lifted the benchmark index above the 158,000 mark amid cautious optimism over easing geopolitical tensions in the Middle East. Analysts attributed the positive momentum a day earlier to softer international oil prices and expectations of de-escalation in regional tensions, which bolstered investor confidence. Topline Securities on Wednesday said the market’s upward trajectory was supported by strong performances from index-heavy stocks, including MCB Bank, Fauji Fertiliser Company, Systems Ltd, Lucky Cement and Hub Power Company, which collectively added 1,613 points to the index. Trading activity remained robust on Wednesday, with total volume recorded at around 612 million shares and turnover at Rs34.5 billion. Unity Foods led the volumes chart, with approximately 72m shares traded. Ali Najib of Arif Habib Ltd said the PSX witnessed broad-based buying, with the benchmark index gaining 2.82pc as sentiment improved on the back of easing geopolitical concerns. He noted that renewed diplomatic efforts, including Pakistan’s role in facilitating dialogue between the United States and Iran, helped fuel optimism about a potential de-escalation.",https://www.dawn.com/news/1985522/bears-take-control-as-psx-plunges-over-5000-points,2026-03-26T17:39:01+05:00,2026-03-26,"Bears take control as PSX plunges over 5,000 points The Pakistan Stock Exchange’s (PSX) benchmark index KSE-100 plunged over 5,000 points on Thursday. The KSE-100 declined by 5,405.48 points or 3.41 per cent to close at 152,907.96 from the previous close of 158,313.44. The index rose to an intraday high of 157,591.23 points at around 10:05am, and then declined to an intraday low of 152,668.07 points at around 3:15pm, before settling at 152,907.96. According to Topline Securities, “the market experienced sustained selling pressure throughout the day”. It added that the index “predominantly” traded in “negative territory as investors remained cautious amid persistent volatility in international oil prices and ongoing global uncertainty”. Topline Securities noted that “key index-heavy stocks, including United Bank Limited, Fauji Fertiliser Company, Engro Holdings Limited, Lucky Cement Limited, and the Hub Power Company Limited, acted as major drags on the market”. It said that the companies “collectively” pulled the index down “by approximately 2,138 points during the session”. It added that in terms of volume, K-Electric Limited “led the activity chart, with over 96 million shares traded during the day”. “The total traded volume for the session stood at 521m shares, while the overall traded value was recorded at Rs27 billion,” it added. On Wednesday, value-hunting had lifted the benchmark index above the 158,000 mark amid cautious optimism over easing geopolitical tensions in the Middle East. Analysts attributed the positive momentum a day earlier to softer international oil prices and expectations of de-escalation in regional tensions, which bolstered investor confidence. Topline Securities on Wednesday said the market’s upward trajectory was supported by strong performances from index-heavy stocks, including MCB Bank, Fauji Fertiliser Company, Systems Ltd, Lucky Cement and Hub Power Company, which collectively added 1,613 points to the index. Trading activity remained robust on Wednesday, with total volume recorded at around 612 million shares and turnover at Rs34.5 billion. Unity Foods led the volumes chart, with approximately 72m shares traded. Ali Najib of Arif Habib Ltd said the PSX witnessed broad-based buying, with the benchmark index gaining 2.82pc as sentiment improved on the back of easing geopolitical concerns. He noted that renewed diplomatic efforts, including Pakistan’s role in facilitating dialogue between the United States and Iran, helped fuel optimism about a potential de-escalation.",1
dawn_business,dawn,Government winds up dysfunctional SPL,"ISLAMABAD: The government on Thursday formally decided to wind up the dysfunctional Sarmaya-e-Pakistan Ltd (SPL), which was created during the PTI tenure to handle the financial and governance affairs of more than 441 state-owned enterprises (SOEs) for their turnaround, following models used in Malaysia and Singapore. The decision was made at a meeting of the Cabinet Committee on State-Owned Ente­rprises, which deferred a decision on exempting two Sui gas companies and other energy sector SOEs from International Financial Reporting Standards (IFRS 14 &amp; 9) due to ma­­ssive receivables arising from circular debt. The meeting, presided over by Finance Minister Muhammad Aurangzeb, also approved the boards of directors of several other SOEs, most of which had already received Prime Minister approval. An official statement said the committee reviewed and approved a summary from the Finance Division regarding the winding up of SPL, noting its redundancy after recent cha­nges in the governance framework for SOEs. Most of these entities are now monitored by the central monitoring unit of the Ministry of Finance and are governed under different corporate governance rules, while others fall under the Pakistan Sovereign Wealth Fund. SPL was created on paper by the PTI government in its early days to turn around over 440 SOEs. However, it was never operationalised, as the majority of cabinet members supported an alternative institutional reform proposed by Dr Ishrat Husain, which continues to be implemented today. The committee also approved the appointment of four independent and three ex-officio members to the board of directors of the Special Purpose Vehicle for the Thar Coal Rail Connectivity Project. Published in Dawn, March 27th, 2026",https://www.dawn.com/news/1985762/government-winds-up-dysfunctional-spl,2026-03-27T08:45:00+05:00,2026-03-27,"Government winds up dysfunctional SPL ISLAMABAD: The government on Thursday formally decided to wind up the dysfunctional Sarmaya-e-Pakistan Ltd (SPL), which was created during the PTI tenure to handle the financial and governance affairs of more than 441 state-owned enterprises (SOEs) for their turnaround, following models used in Malaysia and Singapore. The decision was made at a meeting of the Cabinet Committee on State-Owned Ente­rprises, which deferred a decision on exempting two Sui gas companies and other energy sector SOEs from International Financial Reporting Standards (IFRS 14 &amp; 9) due to ma­­ssive receivables arising from circular debt. The meeting, presided over by Finance Minister Muhammad Aurangzeb, also approved the boards of directors of several other SOEs, most of which had already received Prime Minister approval. An official statement said the committee reviewed and approved a summary from the Finance Division regarding the winding up of SPL, noting its redundancy after recent cha­nges in the governance framework for SOEs. Most of these entities are now monitored by the central monitoring unit of the Ministry of Finance and are governed under different corporate governance rules, while others fall under the Pakistan Sovereign Wealth Fund. SPL was created on paper by the PTI government in its early days to turn around over 440 SOEs. However, it was never operationalised, as the majority of cabinet members supported an alternative institutional reform proposed by Dr Ishrat Husain, which continues to be implemented today. The committee also approved the appointment of four independent and three ex-officio members to the board of directors of the Special Purpose Vehicle for the Thar Coal Rail Connectivity Project. Published in Dawn, March 27th, 2026",1
